{
  "command": "bash tests/run.sh",
  "commandSha256": "2f55041e4c72f2ba8d075d6f7bfbbde9736fca7ad1944c77183b950f4c0990d9",
  "durationMs": 0,
  "evidenceBindingSha256": "43635545b4fa919c28fc60506b16c452eb1f3c74cd8f26f77d7934e541050b25",
  "evidenceOnly": false,
  "expectedFailures": [],
  "failureSignals": [],
  "headSha": "93b13a47497d5ed179247ed4b4434a043cd63f3e",
  "infrastructureSignals": [],
  "logBytes": 6586,
  "logPath": "docs/orchestration/gates/evidence/rel-02-try-hygiene.regression.txt",
  "logRef": "docs/orchestration/gates/evidence/rel-02-try-hygiene.regression.txt",
  "logSha256": "8646d137c1b11a96a89bd34bcb897ebcd55bc279a95cec190a9f34cb9310d4c1",
  "outcome": "passed",
  "phase": "integration",
  "rawExitCode": 0,
  "recordedAt": "2026-08-14T06:21:45Z",
  "resolvedExpectedFailures": [],
  "runId": "ORIGIN-20260814T055942Z-33888",
  "schema": "singular.orchestration.gate-report.v0",
  "sourceIntegrity": {
    "changedPaths": [],
    "status": "not-checked"
  },
  "taskId": "TASK-0110",
  "unexpectedFailures": [],
  "workspaceKind": "integration"
}
