{
  "command": "bash .singular-state/operator-promotion-gate.sh",
  "commandSha256": "c9bfb3a53c6c80f68e7f10b30c9ba1a33bf17368ff794fe0f20d5577ba47d8eb",
  "durationMs": 0,
  "evidenceBindingSha256": "c8646a345dfe00eecdb036d615ded04b67af043bab5abff9f559de919214b2e7",
  "evidenceOnly": false,
  "expectedFailures": [],
  "failureSignals": [],
  "headSha": "41380c1b470585cbbbba2633a5fa564211893bff",
  "infrastructureSignals": [],
  "logBytes": 6722,
  "logPath": "docs/orchestration/gates/evidence/rel-00-contract.regression.txt",
  "logRef": "docs/orchestration/gates/evidence/rel-00-contract.regression.txt",
  "logSha256": "01d24bb7621d61f501185f34e982d3a0e759ae298ae4d027457ac03358755c7c",
  "outcome": "passed",
  "phase": "integration",
  "rawExitCode": 0,
  "recordedAt": "2026-08-13T20:27:09Z",
  "resolvedExpectedFailures": [],
  "runId": "ORIGIN-20260813T200459Z-25969",
  "schema": "singular.orchestration.gate-report.v0",
  "sourceIntegrity": {
    "changedPaths": [],
    "status": "not-checked"
  },
  "taskId": "TASK-0108",
  "unexpectedFailures": [],
  "workspaceKind": "integration"
}
