{
  "command": "bash tests/run.sh",
  "commandSha256": "2f55041e4c72f2ba8d075d6f7bfbbde9736fca7ad1944c77183b950f4c0990d9",
  "durationMs": 0,
  "evidenceBindingSha256": "e6df8da0d8b7106068595004e3731d91d873714960eef7749c3ee6a9ece64a48",
  "evidenceOnly": false,
  "expectedFailures": [],
  "failureSignals": [],
  "headSha": "9c1f2e7b5703d00f476b2115442938c57779f813",
  "infrastructureSignals": [],
  "logBytes": 6586,
  "logPath": "docs/orchestration/gates/evidence/rel-01-per-try-logs.regression.txt",
  "logRef": "docs/orchestration/gates/evidence/rel-01-per-try-logs.regression.txt",
  "logSha256": "8646d137c1b11a96a89bd34bcb897ebcd55bc279a95cec190a9f34cb9310d4c1",
  "outcome": "passed",
  "phase": "integration",
  "rawExitCode": 0,
  "recordedAt": "2026-08-14T00:47:13Z",
  "resolvedExpectedFailures": [],
  "runId": "ORIGIN-20260813T235754Z-8483",
  "schema": "singular.orchestration.gate-report.v0",
  "sourceIntegrity": {
    "changedPaths": [],
    "status": "not-checked"
  },
  "taskId": "TASK-0109",
  "unexpectedFailures": [],
  "workspaceKind": "integration"
}
