{
  "command": "bash tests/run.sh",
  "commandSha256": "2f55041e4c72f2ba8d075d6f7bfbbde9736fca7ad1944c77183b950f4c0990d9",
  "durationMs": 0,
  "evidenceBindingSha256": "5d7297b47cc2dbbbf8a1de6d074e70cd64493c104442f0cae64a3029cba77c48",
  "evidenceOnly": false,
  "expectedFailures": [],
  "failureSignals": [],
  "headSha": "83e7cf72f2c1bf47c6326f1cc0b8bf0345e2f622",
  "infrastructureSignals": [],
  "logBytes": 6586,
  "logPath": "docs/orchestration/gates/evidence/rel-03-integrity-reclass.regression.txt",
  "logRef": "docs/orchestration/gates/evidence/rel-03-integrity-reclass.regression.txt",
  "logSha256": "8646d137c1b11a96a89bd34bcb897ebcd55bc279a95cec190a9f34cb9310d4c1",
  "outcome": "passed",
  "phase": "integration",
  "rawExitCode": 0,
  "recordedAt": "2026-08-14T19:43:46Z",
  "resolvedExpectedFailures": [],
  "runId": "ORIGIN-20260814T191755Z-29494",
  "schema": "singular.orchestration.gate-report.v0",
  "sourceIntegrity": {
    "changedPaths": [],
    "status": "not-checked"
  },
  "taskId": "TASK-0111",
  "unexpectedFailures": [],
  "workspaceKind": "integration"
}
