{
  "command": "bash tests/run.sh",
  "commandSha256": "2f55041e4c72f2ba8d075d6f7bfbbde9736fca7ad1944c77183b950f4c0990d9",
  "durationMs": 0,
  "evidenceBindingSha256": "db2db9a0dd78cf06680c08d2f57750f76a6e833b5b5465abb3fb39a9c35f4e4e",
  "evidenceOnly": false,
  "expectedFailures": [],
  "failureSignals": [],
  "headSha": "9919712055d990a2e5bf162796861cb84196ac6d",
  "infrastructureSignals": [],
  "logBytes": 6586,
  "logPath": "docs/orchestration/gates/evidence/rel-08-route-transcript.regression.txt",
  "logRef": "docs/orchestration/gates/evidence/rel-08-route-transcript.regression.txt",
  "logSha256": "8646d137c1b11a96a89bd34bcb897ebcd55bc279a95cec190a9f34cb9310d4c1",
  "outcome": "passed",
  "phase": "integration",
  "rawExitCode": 0,
  "recordedAt": "2026-08-14T20:35:32Z",
  "resolvedExpectedFailures": [],
  "runId": "ORIGIN-20260814T201036Z-94013",
  "schema": "singular.orchestration.gate-report.v0",
  "sourceIntegrity": {
    "changedPaths": [],
    "status": "not-checked"
  },
  "taskId": "TASK-0116",
  "unexpectedFailures": [],
  "workspaceKind": "integration"
}
